0	2024-07-25 22:35:10Z	Sorry, planned but not yet available
1	2024-07-28 01:50:06Z	World of Warcraft Evoker game play
2	2024-07-28 01:54:51Z	Devastation Evoker priorities
3	2024-07-24 23:00:59Z	World of warcraft evoker preservation gameplay
4	2023-09-07 02:26:52Z	World of warcraft dragonflight season 1 dungeons
5	2023-09-07 02:26:52Z	December 2022 week 2 2022 world of warcraft checklist
6	2023-09-07 02:26:52Z	Pop_OS! window management setup
7	2023-09-07 02:26:52Z	A Linux distribution called Pop_OS!
8	2023-09-07 02:26:52Z	Pop_OS! unable to run jest
9	2023-09-15 20:21:14Z	The processes of migrating my private zets to my public zets
10	2024-07-28 05:27:28Z	How I manage my secret dot files using a usb stick
11	2024-07-28 05:31:07Z	Unix help pages with color
12	2024-07-28 05:33:36Z	How to view and edit pdfs and the command line
13	2024-07-28 05:35:19Z	Nginx clear cache hack with echo ""
14	2024-07-28 05:48:12Z	Fierce armor kit construction cost calculation
15	2024-07-28 05:56:31Z	How to quickly test out space vim
16	2024-07-28 05:40:49Z	How to quickly spin up a dev environment for testing with docker
17	2024-07-28 05:58:53Z	How to manage files in vanilla vim with netrw
18	2023-09-07 02:26:52Z	Quick start on settup lsp for neovim lua hacking
19	2024-07-11 13:06:52Z	Package management in neovim with mason
20	2023-09-07 02:26:52Z	Pattern for managing keybindings in neovim
21	2023-09-07 02:26:52Z	Quick fix list in neovim
22	2023-09-07 02:26:52Z	Rust installation process annoyances
23	2024-06-09 17:13:01Z	Node version management with nvm
24	2023-09-07 02:26:52Z	Example of a vm with out a garbage collect
25	2023-09-07 02:26:52Z	Schema google thing
26	2023-09-07 02:26:52Z	How to export postman files
27	2023-09-07 02:26:52Z	Thanksgiving bread bowl 2022
28	2023-09-07 02:26:52Z	Configuration of IntelliJ IDEA and friends
29	2024-06-13 23:16:52Z	Sat 17 Dec 2022 farrel's kick boxing party
30	2023-09-07 02:26:52Z	World of warcraft dragonflight season 1
31	2023-09-07 02:26:52Z	Halls of Valor dungeon
32	2024-05-21 00:22:45Z	World of Warcraft court of stars dungeon
33	2024-07-15 04:23:44Z	Bash scripting tricks
34	2024-07-04 17:53:38Z	Recommend language sever to use for golang development
35	2023-09-07 02:26:52Z	Key things that make neovim as an ide
37	2023-09-07 02:26:52Z	File type specific settings in neovim
38	2023-09-07 02:26:52Z	Shadow moon burial grounds dungeon
39	2023-09-07 02:26:52Z	Halls of valor dungeon
40	2023-09-07 02:26:52Z	How to get a portal mailbox in world of warcraft
41	2023-09-07 02:26:52Z	References to other peoples dotfiles that I find interesting
42	2023-09-07 02:26:52Z	How to update fields using mongosh
43	2023-09-07 02:26:52Z	How to do complex filtering with mongosh
44	2023-09-07 02:26:52Z	Example neovim setups that other people use
45	2023-09-07 02:26:52Z	Cool streaming setup that I should look into
46	2023-09-07 02:26:52Z	Mon 26 Dec 2022 world of warcraft weekly checklist
47	2023-09-07 02:26:52Z	Transmogs for windborne velocidrake
48	2023-09-07 02:26:52Z	World of warcraft weekly checklist 
49	2023-09-07 02:26:52Z	Formatting in neovim
50	2023-09-07 02:26:52Z	Neovim workspaces
51	2023-09-07 02:26:52Z	Alacrity configuration notes
52	2023-09-07 02:26:52Z	Obsidian Dracthyr Battlegear
53	2023-09-07 02:26:52Z	Gold and black armor for dragon riding mounts
54	2023-09-07 02:26:52Z	Broodkeeper diurna boss fight
56	2023-09-07 02:26:52Z	Interesting things that I ran into when researching neovim as an ide
57	2023-09-07 02:26:52Z	Top typing program out there
58	2023-09-07 02:26:52Z	Skeuomorphism website design
59	2024-07-16 22:14:04Z	Person: Foony's developer acorn1010
60	2023-09-07 02:26:52Z	Dragonflight leather working recipes
61	2023-09-07 02:26:52Z	How to setup fira code fonts on windows
62	2023-09-07 02:26:52Z	Zettelkasten search engine
63	2023-09-07 02:26:52Z	How does a generic search engine work for the web
64	2023-09-07 02:26:52Z	Top gear for warlock
65	2023-09-07 02:26:52Z	Recommended warlock spec for Aberrus bosses
67	2023-11-30 18:39:27Z	My first user experience with keg
69	2023-09-07 02:26:52Z	Config files for zsh environment
70	2023-09-07 02:26:52Z	Useful oh my zsh plugins list
71	2024-05-28 14:17:37Z	How to handle conditionals in bash scripting
72	2023-09-07 02:26:52Z	Pop_OS! setup
73	2023-09-07 02:26:52Z	Example of keyword searching with awk
74	2023-12-01 18:30:11Z	Git techniques and cheat sheet
75	2023-09-07 02:26:52Z	Tiling window management in windows with komorebi
76	2023-09-07 02:26:52Z	Harpoon keybindings in vscode
77	2024-07-16 15:35:32Z	Article: Really good article about software engineering principles
78	2023-09-07 02:26:52Z	Quick fix menus in vim
79	2024-07-04 18:22:35Z	An example of a bash script that has tab completion
80	2024-07-04 18:24:20Z	Person: Rob Muhlestein
81	2023-09-07 02:26:52Z	rwxrob's list of go packages
82	2023-09-07 02:26:52Z	How to give credit to the original script owner
83	2023-09-07 02:26:52Z	Managing personal secrets with an external USB drive
84	2023-09-07 02:26:52Z	My preferred way of handling text width in documents
85	2023-09-07 02:26:52Z	How to install rust properly to prevent mucking with dotfiles
86	2023-09-07 02:26:52Z	How to verify file integrity on the cli
87	2023-09-07 02:26:52Z	Logitech G604 issues on macOS
88	2024-07-26 22:30:45Z	My MacOS workstation setup
89	2023-09-07 02:26:52Z	Logitech G604 issues on macOS
90	2023-09-07 02:26:52Z	Sanity content management system
91	2024-05-13 19:12:23Z	How to swap caps lock on MacOS
92	2023-09-07 02:26:52Z	Must have plugins for google chrome
93	2024-06-11 19:38:17Z	Installing patched power line fonts for MacOS
94	2024-07-04 17:04:23Z	fzf setup and usage
95	2023-09-07 02:26:52Z	How to set path variables on MacOS
96	2024-05-04 20:28:50Z	keg create git issue
97	2023-09-07 02:26:52Z	Ergonomic mouse research
99	2024-07-28 05:54:19Z	Fedora workstation setup
100	2024-03-27 16:14:01Z	Install flutter on macOSX with apple silicon
101	2024-04-22 18:01:49Z	Installing software with curl
102	2024-07-28 05:27:58Z	Using a temporary directory that require installing transient scripts
103	2024-07-28 05:29:09Z	Tiling window management on macOS with Yabai
104	2024-07-28 01:52:52Z	Overview: MacOSX tools and software
105	2024-07-28 05:28:49Z	Concrete 5
106	2024-07-28 05:29:44Z	How to install lando on MacOS
107	2024-07-28 05:30:12Z	Date standards
108	2024-06-30 20:42:07Z	Research: Wowhead diablo 4 class ranking comparison
109	2024-04-16 21:44:10Z	MacOS vs Linux difference
110	2024-07-28 05:31:27Z	My personal PHP style guide
111	2024-07-28 05:31:55Z	My personal Bash style guide
112	2024-05-30 22:27:52Z	My personal typescript style guide
113	2024-07-28 05:46:04Z	Managing contexts with bash
114	2024-07-28 05:32:39Z	Overview: Samsung S22+ device specification
115	2024-07-28 05:41:28Z	Recommended android SDK target for new android apps
116	2024-07-28 05:45:41Z	Lando concepts
117	2024-07-11 14:02:58Z	Overview: Mailhog
118	2024-07-11 14:07:28Z	Reason why some things will not work on apple
119	2024-07-28 05:46:31Z	Tmux integration with iTerm 2
120	2024-07-28 05:35:41Z	Diablo 4 completions
121	2024-07-28 05:41:55Z	Necromancer leveling build on Diablo 4
122	2024-07-28 05:47:10Z	My vim setup
123	2024-07-28 05:49:37Z	Problems with Linux as a workstation
124	2024-05-15 21:58:49Z	Sync a directory with rsync
125	2024-07-16 02:53:30Z	Programmatic bash completions
126	2024-07-28 05:50:41Z	Golang development loop with multi repos
127	2024-07-28 05:47:41Z	A quick to making a module in golang
128	2024-07-28 05:48:33Z	WordPress plugin Gravity forms
129	2024-07-28 05:34:06Z	How to use arrays in bash
130	2024-07-28 05:48:58Z	How to configure bash scripting behavior
131	2024-07-28 05:51:42Z	WordPress development key concepts
132	2024-07-28 05:57:34Z	How to get started developing themes and plugins with WordPress
133	2024-07-15 13:51:23Z	OS Fingerprinting strategies in bash
134	2024-07-28 05:59:58Z	Recommended PHP language server to use
135	2024-06-30 17:29:32Z	Task to figure out how to make scrolling faster on MacOS
136	2024-07-21 15:03:08Z	How to setup VSCode for PHP and WordPress development
137	2024-07-28 05:52:44Z	Place: Como Park Zoo and Conservatory in St Paul Minnesota
138	2023-09-07 02:26:52Z	Cuzzy's Grill and bar in downtown Minneapolis
139	2024-07-28 05:53:13Z	How to setup bbPress forums in WordPress
140	2024-07-28 05:36:06Z	How to create your own theme in WordPress
141	2024-07-28 05:38:30Z	Issue: Task to fix keybinding issues between MacOS and ranger
142	2024-07-28 05:58:08Z	How to effectively use cp
143	2024-07-28 05:37:29Z	Event: M23SS brewery event at Blackstack Brewing
144	2024-07-26 20:37:40Z	Minneapolis 20s 30s something social meetup group (M23SS)
147	2023-09-07 02:26:52Z	Where to get started when design a system
148	2024-07-28 05:53:35Z	Domain model for yabai
149	2023-09-07 02:26:52Z	Useful WordPress plugins
150	2023-09-07 02:26:52Z	Basics of skip links in web development
151	2024-07-28 05:39:06Z	Official WordPress theme review process
152	2023-09-07 02:26:52Z	How to setup tailwind for WordPress
153	2024-07-28 05:56:08Z	Overview of a classic theme in WordPress
154	2023-09-07 02:26:52Z	Query strings are thought to impede indexing of dynamic pages
155	2023-09-07 02:26:52Z	Overview of a block theme in WordPress
156	2023-09-07 02:26:52Z	Overview of the block editor in WordPress
157	2024-07-28 05:58:31Z	Overview of themes in WordPress
158	2024-07-28 05:40:27Z	Thinking about a Zettelkasten organization as a form a taxonomy
159	2024-06-07 03:53:05Z	Full list of operating systems that ansible is able to detect
160	2024-07-28 05:39:35Z	How to install homebrew on a MacOS
161	2024-05-19 04:17:02Z	How to benchmark zsh
162	2023-09-07 02:26:52Z	Look into the fidget rewrite issue
163	2024-06-11 19:38:23Z	How to manage ssh keys
164	2024-07-28 05:55:08Z	How to get started with the redfin api
166	2024-07-28 05:54:43Z	The service userzoom for doing UX research
167	2023-09-07 02:26:52Z	Overview of the sales CMS Zendesk
168	2024-07-28 05:56:52Z	How to work with gradients with tailwind
169	2023-09-07 02:26:52Z	Headless CMS options for managing content
171	2023-09-07 02:26:52Z	E-commerce headless CMS domain model
172	2023-09-07 02:26:52Z	MLSGrid
173	2023-09-07 02:26:52Z	Example scan line effect with tailwind
174	2023-12-05 20:38:11Z	My personal website design
175	2024-02-04 01:25:15Z	jq cheat sheet
177	2024-07-28 16:05:56Z	WordPress development overview
178	2023-09-07 02:26:52Z	What is an electrical component distributor
179	2023-09-07 02:26:52Z	What is a custom wire cutting service
180	2023-09-07 02:26:52Z	WordPress block theme development prompt for chatGPT
181	2024-07-28 06:00:24Z	WordPress email integrations
182	2024-07-28 06:00:42Z	What is platform requirements
183	2023-09-07 02:26:52Z	WordPress hosting on GoDaddy
184	2023-09-07 02:26:52Z	WordPress hosting on WP Engine
185	2024-05-19 19:16:23Z	Managing styles for block theme in WordPress
186	2023-09-07 02:26:52Z	How to include CSS in a block theme for WordPress
187	2023-09-07 02:26:52Z	How to use `PostCSS` and `autoprefixer` in WordPress
188	2023-09-07 02:26:52Z	Mental health disability anomia
189	2024-07-28 06:01:22Z	How to implement a contact form with MailChimp
190	2024-07-28 06:01:50Z	Overview: of the service Mailchimp (mailchimp)
191	2023-09-07 02:26:52Z	Common patterns that I use for headers for my Zettelkasten
192	2023-09-07 02:26:52Z	What is `mim`
193	2023-09-07 02:26:52Z	MX Vertical mouse
194	2023-09-07 02:26:52Z	Opinionated go repo naming conventions
195	2023-09-07 02:26:52Z	WordPress hosting
196	2023-09-07 02:26:52Z	WordPress hosting with WPEngine
197	2023-09-07 02:26:52Z	A nifty way to compare versions
198	2023-09-07 02:26:52Z	How to manage dependencies with git submodules
199	2023-09-07 02:26:52Z	Top stats for warlock in dragon flight season 2
200	2024-07-11 14:30:39Z	How to utilize these notes
202	2024-06-21 02:22:52Z	Optimal rice to water ratio
203	2023-09-07 02:26:52Z	A possible thing to look out for if you see a spike in traffic
204	2023-09-07 02:26:52Z	Web development security risk types
205	2023-09-07 02:26:52Z	What is the benefit of paid for SSL
206	2023-09-07 02:26:52Z	SEO concepts
207	2023-09-07 02:26:52Z	Common breakpoints between browsers on different devices
208	2023-09-07 02:26:52Z	My typical pattern of devices to target
209	2023-09-07 02:26:52Z	What is the idea width for readable text
210	2023-09-07 02:26:52Z	WordPress community
211	2023-09-07 02:26:52Z	WordPress domain experts
212	2024-07-28 01:48:52Z	Place: Blackstack Brewing
213	2023-09-07 02:26:52Z	The brewery Clutch Brewing
214	2023-09-11 03:24:05Z	Brewery Bahaus Brew Labs
215	2024-05-14 02:28:04Z	Flexbox CSS attributes
216	2023-09-07 02:26:52Z	How to load custom CSS for a WordPress block
217	2024-06-11 21:35:55Z	How to build a generic accordion in WordPress
219	2023-09-07 02:26:52Z	How to configure the editor in WordPress
220	2023-09-07 02:26:52Z	How to grab a specific item in a tar file
221	2024-06-08 15:37:36Z	How I use chezmoi to manage my dot files
222	2023-09-07 02:26:52Z	How to setup a contact us page in WordPress
224	2024-06-19 16:09:53Z	WordPress docker container
225	2023-09-07 02:26:52Z	Tips when researching laptops
226	2023-09-07 02:26:52Z	WordPress plugin development overview
228	2023-10-24 21:24:09Z	pnpm mono repo strategy
229	2023-09-07 02:26:52Z	What is critical thinking
230	2023-09-07 02:26:52Z	Article about HCTA real world outcomes
231	2023-09-07 02:26:52Z	Problem solution sets
232	2024-07-12 20:21:57Z	PCI-DSS compliance
233	2023-09-07 02:26:52Z	What is Multi-Factor authentication
235	2024-07-02 20:52:12Z	Categorization of numbers
236	2024-06-11 21:09:04Z	Accordion plugins for WordPress
237	2023-09-07 02:26:52Z	COC Categorization
238	2023-09-07 02:26:52Z	Wooden ship brewing
239	2023-09-07 02:26:52Z	The Word of Warcraft addons that I use
240	2023-09-07 02:26:52Z	980 pro NVME upgrade on the XPS 9710
241	2024-01-17 19:34:45Z	Portable pizza oven buying checklist
242	2023-09-07 02:26:52Z	Bertello portable 12" pizza oven
243	2023-09-07 02:26:52Z	How to create a new category for blocks
244	2023-09-07 02:26:52Z	WordPress block editor domain model
245	2023-09-07 02:26:52Z	How to add a new post type in WordPress
246	2023-09-07 02:26:52Z	Chezmoi cheatsheet
247	2024-07-26 22:29:45Z	How to increase cursor speed on MacOSX
248	2023-09-07 02:26:52Z	Keg and Case Market
249	2024-06-07 17:56:20Z	How to convert JSON typescript schema
250	2023-12-01 17:38:30Z	Types of sourdough preferments
251	2024-05-20 21:41:36Z	How to setup automated change logs with github actions
252	2023-09-07 02:26:52Z	List of core blocks for the block editor
253	2023-09-29 02:37:22Z	Docker compose service cli interactions
254	2023-09-07 02:26:52Z	CSS grid attributes and cheatsheet
255	2023-09-07 02:26:52Z	Introductory material for statistics
256	2024-05-15 19:47:32Z	Recommended image types to use on the web
257	2023-09-07 02:26:52Z	Article about how PostCSS is an alternatie to SCSS
258	2023-09-07 02:26:52Z	Managing encrypted data with ssh keys
259	2024-07-12 02:07:47Z	Automatically rerunning commands with `entr`
260	2023-09-07 02:26:52Z	Types of pizza
261	2023-09-21 19:05:25Z	Hugo theme development loop
262	2023-09-07 02:26:52Z	Seamless navigation between tmux and vim
263	2023-09-07 02:26:52Z	An interesting article about LINQ in JavaScript
264	2023-09-07 02:26:52Z	Research on type of mic for my streaming
265	2023-09-26 23:45:16Z	Steps to host a keg with GitHub pages
266	2023-09-07 02:26:52Z	The idea of cognitive distance
267	2023-09-07 02:26:52Z	Jekyll theme **hacker** google analytics issue
268	2024-07-14 21:43:35Z	Keg introduction
269	2023-09-07 02:26:52Z	When to use CGO_ENABLED
270	2023-09-11 22:48:40Z	Streaming setup research
271	2023-09-07 02:26:52Z	Digital ocean resource support
272	2023-09-07 02:26:52Z	Arch linux setup on Terra
273	2023-09-07 02:26:52Z	Pacman cheatsheet and usage patterns
274	2023-09-07 02:26:52Z	Setting up refind as a boot loader
275	2023-09-07 02:26:52Z	EDID emulator
276	2023-09-07 02:26:52Z	Ranger alternatives
277	2023-09-07 02:26:52Z	AwesomeWM Terminology
278	2023-09-07 02:26:52Z	How to replace a missing MN license plate
279	2024-05-03 01:36:40Z	Vim, tmux and ssh copy and paste madness
280	2024-06-24 14:33:28Z	Git techniques and cheatsheet
281	2023-09-07 02:26:52Z	Personal dotfiles
282	2023-10-17 14:58:42Z	Github CLI tips and tricks
283	2023-09-07 02:26:52Z	PGP cheatsheet
284	2023-09-07 02:26:52Z	Meetup.com alternative idea
285	2023-11-26 00:08:56Z	How to setup HP Officejet j4680 for printing
286	2023-09-07 02:26:52Z	Mythic plus progress on Ravalock for season 2
287	2023-09-07 02:26:52Z	Arch linux setup on blaze
288	2023-09-07 02:26:52Z	Solution to being locked out of arch linux
289	2023-11-13 17:30:24Z	Research for tendonitis issue
290	2024-07-29 14:25:10Z	Hardware: Kineses Advantage 360
291	2023-09-07 02:26:52Z	Linux desktop comparison
292	2024-07-24 18:45:21Z	Overview: Baking (baking)
293	2024-01-27 20:37:45Z	Labor day weekend bread bowl
294	2024-01-27 20:36:04Z	Sourdough somewhat whole wheat pizza for the ooni
295	2024-01-27 20:36:59Z	Pizza night at the cabin pizza dough
296	2024-01-27 20:35:24Z	Whole wheat tortilla recipe
297	2024-01-12 22:13:55Z	First bigga sourdough pizza batch for the Ooni
298	2024-01-11 18:49:56Z	Bigga sourdough pizza dough Saturday July 22 2023
299	2024-01-11 18:48:55Z	July fourth weekend 2023 sourdough bread bowl
301	2024-01-11 18:49:29Z	July fourth weekend 2023 sourdough pizza
302	2024-06-30 19:18:13Z	Large sourdough pizza batch for BYOT pizza event
303	2024-01-11 17:55:05Z	Thu Apr 20 2023 sourdough pizza
304	2024-01-11 17:55:47Z	Memorial day sourdough bread bowl
305	2024-01-11 17:49:14Z	Thanksgiving bread bowl 2022
306	2024-01-11 18:31:41Z	Father's day whole wheat sourdough batard
307	2024-01-11 17:55:26Z	Whole wheat sourdough loaf
308	2024-01-11 17:54:03Z	Experimental whole wheat pizza sourdough small batch
309	2024-01-11 17:54:31Z	Sourdough Pizza experiment
310	2024-01-11 17:53:18Z	Experimental rye and barley pullman loaf
311	2024-01-11 17:53:05Z	Einkorn sourdough bread bowl
312	2024-07-28 16:20:27Z	Sourdough pizza
315	2023-09-07 02:26:52Z	How to manually install a package from the AUR
316	2024-07-04 17:05:52Z	Research: a Rofi like experience on MacOSX
317	2024-07-08 04:52:13Z	Sourdough pizza dough batch request
319	2023-09-11 04:32:54Z	Recommend wheat flour to use for different bakes
321	2023-11-02 01:45:21Z	Chrome book comparison
322	2023-09-10 19:05:06Z	Digital fonts
323	2023-09-10 19:22:55Z	Modern software configuration management specification Unix systems
324	2023-09-12 19:23:17Z	Cool idea for my own website
325	2023-09-26 23:46:00Z	Managing ruby version on MacOSX with chruby
326	2023-09-26 23:46:09Z	Setting up a new KEG app with tina and jekyll
327	2023-09-16 02:19:26Z	KEG repo with tina cms and jekyll experiment
328	2024-01-27 20:39:08Z	Sourdough rye and barley pancakes
329	2023-09-16 15:55:05Z	Chia jam recipe
330	2023-09-18 15:50:10Z	Testing in Go
331	2024-01-27 20:39:55Z	Sourdough rye and barley pita bread
332	2024-07-24 18:56:29Z	Hardware: My Ooni Karu 12G
333	2024-03-27 16:14:58Z	Flutter experiments
334	2024-06-05 22:02:05Z	KEG website with CMS
335	2023-09-27 23:01:04Z	AWS Access management
336	2024-02-05 03:51:06Z	AWS Certifications
337	2023-11-19 01:33:46Z	AWS Developer Associate Exam
338	2023-11-17 16:35:51Z	Deploying a sveltkit app on AWS
339	2024-06-19 15:48:26Z	AWS service elastic beanstalk
340	2023-09-26 23:50:09Z	AWS free tier
343	2023-12-05 19:53:09Z	Learning in public
344	2023-09-26 23:46:54Z	Cool facts about octopus
345	2023-11-25 22:22:23Z	Different types of learning
346	2023-09-26 23:46:26Z	Society requires perfect trust
347	2023-09-28 18:55:49Z	how to login to AWS via command line
348	2023-09-28 00:16:46Z	Deploying a keg on MkDocs
349	2023-11-30 18:37:37Z	Example for how to build a KEG for use with google docs
350	2024-06-26 22:28:22Z	Zip cheatsheet
351	2024-02-11 15:08:48Z	JavaScript article
352	2024-04-16 21:01:22Z	SSH key rotation best practices
353	2023-09-28 18:55:51Z	AWS EC2
354	2024-02-12 19:08:39Z	Strange .pnpm-store appearing in my repo
355	2024-06-28 02:51:15Z	How to use docker for NodeJS development
356	2023-09-29 17:34:11Z	Handling flags in bash
357	2023-10-04 16:30:30Z	Battle tanks the game
358	2023-09-30 17:20:55Z	Docker compose host name resolution
359	2023-09-30 17:34:14Z	Recommended regex syntax to use
360	2023-10-01 05:09:44Z	Effecting centralized logging strategy
361	2023-09-30 20:24:35Z	Proper way to read user input when using Go
362	2024-02-24 19:51:16Z	Simple versioning using changesets
363	2023-10-02 01:29:00Z	Power lifting workout routines
364	2023-11-02 01:53:39Z	Setup OpenSearch AWS for learning
365	2023-11-11 02:45:05Z	How to setup email using AWS SES
366	2023-10-04 14:58:15Z	Multiplayer game with FireBase video
367	2023-10-22 15:29:34Z	Neovim repositories
368	2023-10-06 22:28:16Z	Resources to get started with Ocaml
369	2023-10-04 16:30:32Z	Dynamic colors with SvelteKit and tailwind
370	2024-05-22 04:13:52Z	Middleware pattern with typescript
371	2023-10-04 23:05:24Z	Reactivity concepts in web development
372	2023-10-04 23:06:13Z	React experts
374	2023-10-08 15:59:25Z	Sveltekit how to debounce input
375	2023-10-17 14:58:47Z	AWS Aura serverless database
376	2024-06-30 17:28:16Z	Wireguard for AWS VPC access gateway for Ubuntu server
377	2023-10-13 15:41:20Z	Volunteering at Habitat for Humanity
378	2023-10-17 15:09:21Z	Web authentication strategies
379	2023-10-19 15:49:07Z	Dynamic themes in sveltekit
380	2023-10-20 21:32:36Z	Project management for python
381	2024-05-21 14:27:01Z	Releasing software with python
382	2023-10-21 14:21:49Z	Green curry recipe
383	2023-10-24 03:56:50Z	How I created my first nvim plugin
384	2023-10-24 20:57:05Z	Frontend masters OpenAI and NodeJS
387	2023-10-24 21:37:33Z	mono repo setup with pnpm
389	2023-10-30 15:23:06Z	Tyler Industries entry level .Net role
390	2023-11-02 01:14:41Z	Solid Principles
391	2024-06-10 15:57:27Z	AWS services
392	2023-11-15 16:21:40Z	Simple Queue Service (SQS)
393	2023-11-02 03:07:30Z	Simple Notification Service (SNS)
394	2023-11-02 02:12:26Z	AWS Lambda
395	2023-11-02 02:57:59Z	CI/CD on AWS
396	2023-11-02 02:50:48Z	API Gateway
397	2023-11-02 02:32:34Z	Event monitoring with Amazon CloudWatch
398	2023-11-02 02:43:05Z	Amazon EventBridge
399	2023-11-02 02:44:05Z	X-Ray debugging tool
400	2023-11-02 02:44:30Z	Amazon CodeStar
401	2023-11-02 02:48:17Z	Amazon CodeCommit
402	2023-11-02 02:48:30Z	Amazon CodeBuild
403	2023-11-02 02:50:40Z	Amazon CodeDeploy
404	2023-11-18 19:40:26Z	Amazon CodePipeline
405	2023-11-02 03:07:34Z	Message de-duplication on AWS FIFO topics
406	2024-05-06 14:58:07Z	How to upload a SSH key pair from the CLI to AWS
407	2023-12-30 16:35:25Z	Neovim intellisense for JSON files
408	2023-11-12 23:20:35Z	ECS cluster tutorial
409	2023-11-13 00:27:38Z	Interesting bug in AWS ECS
410	2023-11-15 16:19:19Z	AWS Service CloudFormation
411	2023-11-17 16:18:14Z	AWS Cloud Development Kit (CDK)
412	2024-06-10 15:56:58Z	AWS service CloudTrail
413	2023-11-15 16:29:56Z	AWS CloudWatch
414	2023-11-17 16:16:55Z	AWS Elastic Kubernetes Service EKS
415	2023-11-15 16:33:54Z	AWS Elastic Container Registry (ECR)
416	2023-11-17 16:38:46Z	AWS Cognito
417	2023-11-17 18:48:27Z	AWS Developer Associate study guide
418	2023-11-17 17:32:39Z	AWS Elastic Block Storage
419	2023-11-18 21:11:59Z	AWS Chat app tutorial
420	2023-11-18 19:41:25Z	AWS AppSync
421	2024-01-15 04:03:12Z	AWS Typescript CDK Quick start
422	2024-05-20 22:50:53Z	Proof of concept for a monorepo with changesets
423	2023-11-24 17:50:56Z	Netmagic cloud
424	2023-11-22 20:51:08Z	Test exams
425	2023-11-22 22:38:07Z	Raw module 4 instructions
426	2023-11-26 00:08:45Z	Neuroscience on how learning occurs
427	2023-11-26 00:08:49Z	Strategy for learning
428	2024-01-27 20:40:38Z	Guesswork Sourdough bread
429	2024-06-07 18:00:23Z	Tools needed to setup a npm library for typescript
430	2023-12-05 19:53:42Z	Creating KEG commands plugin in NeoVim
431	2024-05-04 22:14:46Z	Uzbek Lepyoshki experiment
432	2024-05-04 20:56:00Z	Recommended temperature for bread rising with active dry yeast
433	2024-06-18 01:42:48Z	Recommended wine list
434	2023-12-10 19:01:45Z	Micro green index
435	2023-12-10 18:52:12Z	Purple radish micro green batch 1
436	2023-12-11 06:43:37Z	Triton Purple radish sprouts
437	2023-12-05 18:20:52Z	Coco coir for micro green growing
438	2023-12-05 20:37:33Z	Project ideas
439	2024-02-05 19:02:51Z	Knutjs project idea
440	2023-12-26 23:43:04Z	Lazy sourdough Uzbek Lepyoshki experiment
441	2024-05-04 20:47:48Z	Uzbek Lepyoshki take 2
442	2023-12-11 00:24:36Z	General Index
443	2024-02-05 05:15:31Z	Ice Skating in Twin Cities
444	2023-12-21 18:09:42Z	The science of motivation
445	2023-12-17 14:34:26Z	How to belay top rope at climbing gym
446	2024-05-21 00:04:29Z	Mongo style filter example with typescript
447	2024-06-19 23:33:14Z	Zeros shoe comparison chart
448	2024-02-29 19:28:48Z	Stateful command tree using commander js
449	2023-12-22 17:04:10Z	Professional Full Stack developer prompt for ChatGPT
450	2023-12-30 16:23:23Z	Christmas bread bowl 2023
451	2023-12-22 17:19:13Z	Tool and strategies for making sourdough bread
452	2023-12-23 20:05:27Z	Spinach dip recipe
453	2023-12-22 23:01:48Z	How to implement "cook mode" on a website
454	2023-12-23 20:07:29Z	Karble cheat sheet
455	2023-12-25 16:28:29Z	Dill Pickle Tortilla Roll Up recipe
456	2023-12-28 21:56:17Z	Bundling and compiling typescript files
457	2024-01-20 01:55:30Z	Sourdough batard
458	2023-12-30 23:41:04Z	How to shape a batard
459	2023-12-30 17:16:12Z	How to make good sourdough bread
460	2024-01-08 04:14:37Z	.Net core setup for MacOSX and neovim
461	2024-05-18 20:41:58Z	Snippets in neovim
462	2024-01-17 20:42:34Z	Sourdough batard
463	2024-01-10 23:21:43Z	Bartender tips
464	2024-01-10 23:39:31Z	Drink mixing tools and strategies
465	2024-01-11 15:08:44Z	Bartender terminology
466	2024-01-11 14:57:28Z	A list of tech communities on slack
467	2024-01-11 18:47:48Z	SQL and DBMS concepts
